clean,corrupted,correct_token,incorrect_token,transitive_verb,intransitive_verb,template,template_text
When the driver helped the writer who shouted too loud,When the driver collapsed the writer who shouted too loud,for,was,helped,collapsed,garden_npz_v-trans_mod,When the {subj} {verb} the {obj} who {rel}
When the driver collapsed the writer who shouted too loud,When the driver helped the writer who shouted too loud,was,for,helped,collapsed,garden_npz_v-trans_mod,When the {subj} {verb} the {obj} who {rel}
When the doctor helped the teacher who left early,When the doctor waited the teacher who left early,for,was,helped,waited,garden_npz_v-trans_mod,When the {subj} {verb} the {obj} who {rel}
When the doctor waited the teacher who left early,When the doctor helped the teacher who left early,was,for,helped,waited,garden_npz_v-trans_mod,When the {subj} {verb} the {obj} who {rel}
As the scientist arrested the child who made a mistake,As the scientist danced the child who made a mistake,for,was,arrested,danced,garden_npz_v-trans_mod,As the {subj} {verb} the {obj} who {rel}
As the scientist danced the child who made a mistake,As the scientist arrested the child who made a mistake,was,for,arrested,danced,garden_npz_v-trans_mod,As the {subj} {verb} the {obj} who {rel}
While the soldier photographed the woman who called the office,While the soldier panicked the woman who called the office,for,was,photographed,panicked,garden_npz_v-trans_mod,While the {subj} {verb} the {obj} who {rel}
While the soldier panicked the woman who called the office,While the soldier photographed the woman who called the office,was,for,photographed,panicked,garden_npz_v-trans_mod,While the {subj} {verb} the {obj} who {rel}
As the student pushed the doctor who shouted too loud,As the student collapsed the doctor who shouted too loud,for,was,pushed,collapsed,garden_npz_v-trans_mod,As the {subj} {verb} the {obj} who {rel}
As the student collapsed the doctor who shouted too loud,As the student pushed the doctor who shouted too loud,was,for,pushed,collapsed,garden_npz_v-trans_mod,As the {subj} {verb} the {obj} who {rel}
When the student frightened the neighbor who shouted too loud,When the student stumbled the neighbor who shouted too loud,for,was,frightened,stumbled,garden_npz_v-trans_mod,When the {subj} {verb} the {obj} who {rel}
When the student stumbled the neighbor who shouted too loud,When the student frightened the neighbor who shouted too loud,was,for,frightened,stumbled,garden_npz_v-trans_mod,When the {subj} {verb} the {obj} who {rel}
After the criminal visited the woman who told bad jokes,After the criminal vanished the woman who told bad jokes,for,was,visited,vanished,garden_npz_v-trans_mod,After the {subj} {verb} the {obj} who {rel}
After the criminal vanished the woman who told bad jokes,After the criminal visited the woman who told bad jokes,was,for,visited,vanished,garden_npz_v-trans_mod,After the {subj} {verb} the {obj} who {rel}
After the artist attacked the child who forgot the keys,After the artist nodded the child who forgot the keys,for,was,attacked,nodded,garden_npz_v-trans_mod,After the {subj} {verb} the {obj} who {rel}
After the artist nodded the child who forgot the keys,After the artist attacked the child who forgot the keys,was,for,attacked,nodded,garden_npz_v-trans_mod,After the {subj} {verb} the {obj} who {rel}
As the pilot photographed the neighbor who lost the ticket,As the pilot sighed the neighbor who lost the ticket,for,was,photographed,sighed,garden_npz_v-trans_mod,As the {subj} {verb} the {obj} who {rel}
As the pilot sighed the neighbor who lost the ticket,As the pilot photographed the neighbor who lost the ticket,was,for,photographed,sighed,garden_npz_v-trans_mod,As the {subj} {verb} the {obj} who {rel}
While the criminal chased the child who broke the rule,While the criminal panicked the child who broke the rule,for,was,chased,panicked,garden_npz_v-trans_mod,While the {subj} {verb} the {obj} who {rel}
While the criminal panicked the child who broke the rule,While the criminal chased the child who broke the rule,was,for,chased,panicked,garden_npz_v-trans_mod,While the {subj} {verb} the {obj} who {rel}
After the teacher ignored the singer who missed the train,After the teacher shouted the singer who missed the train,for,was,ignored,shouted,garden_npz_v-trans_mod,After the {subj} {verb} the {obj} who {rel}
After the teacher shouted the singer who missed the train,After the teacher ignored the singer who missed the train,was,for,ignored,shouted,garden_npz_v-trans_mod,After the {subj} {verb} the {obj} who {rel}
When the sailor pushed the woman who lost the ticket,When the sailor shouted the woman who lost the ticket,for,was,pushed,shouted,garden_npz_v-trans_mod,When the {subj} {verb} the {obj} who {rel}
When the sailor shouted the woman who lost the ticket,When the sailor pushed the woman who lost the ticket,was,for,pushed,shouted,garden_npz_v-trans_mod,When the {subj} {verb} the {obj} who {rel}
As the doctor arrested the tourist who spoke too softly,As the doctor stumbled the tourist who spoke too softly,for,was,arrested,stumbled,garden_npz_v-trans_mod,As the {subj} {verb} the {obj} who {rel}
As the doctor stumbled the tourist who spoke too softly,As the doctor arrested the tourist who spoke too softly,was,for,arrested,stumbled,garden_npz_v-trans_mod,As the {subj} {verb} the {obj} who {rel}
When the criminal shot the child who paid the bill,When the criminal smiled the child who paid the bill,for,was,shot,smiled,garden_npz_v-trans_mod,When the {subj} {verb} the {obj} who {rel}
When the criminal smiled the child who paid the bill,When the criminal shot the child who paid the bill,was,for,shot,smiled,garden_npz_v-trans_mod,When the {subj} {verb} the {obj} who {rel}
When the detective photographed the student who wrote a letter,When the detective departed the student who wrote a letter,for,was,photographed,departed,garden_npz_v-trans_mod,When the {subj} {verb} the {obj} who {rel}
When the detective departed the student who wrote a letter,When the detective photographed the student who wrote a letter,was,for,photographed,departed,garden_npz_v-trans_mod,When the {subj} {verb} the {obj} who {rel}
While the lawyer betrayed the gardener who spoke too softly,While the lawyer danced the gardener who spoke too softly,for,was,betrayed,danced,garden_npz_v-trans_mod,While the {subj} {verb} the {obj} who {rel}
While the lawyer danced the gardener who spoke too softly,While the lawyer betrayed the gardener who spoke too softly,was,for,betrayed,danced,garden_npz_v-trans_mod,While the {subj} {verb} the {obj} who {rel}
While the tourist betrayed the woman who broke the rule,While the tourist laughed the woman who broke the rule,for,was,betrayed,laughed,garden_npz_v-trans_mod,While the {subj} {verb} the {obj} who {rel}
While the tourist laughed the woman who broke the rule,While the tourist betrayed the woman who broke the rule,was,for,betrayed,laughed,garden_npz_v-trans_mod,While the {subj} {verb} the {obj} who {rel}
While the student mocked the clerk who lost the ticket,While the student nodded the clerk who lost the ticket,for,was,mocked,nodded,garden_npz_v-trans_mod,While the {subj} {verb} the {obj} who {rel}
While the student nodded the clerk who lost the ticket,While the student mocked the clerk who lost the ticket,was,for,mocked,nodded,garden_npz_v-trans_mod,While the {subj} {verb} the {obj} who {rel}
After the scientist arrested the neighbor who answered late,After the scientist wandered the neighbor who answered late,for,was,arrested,wandered,garden_npz_v-trans_mod,After the {subj} {verb} the {obj} who {rel}
After the scientist wandered the neighbor who answered late,After the scientist arrested the neighbor who answered late,was,for,arrested,wandered,garden_npz_v-trans_mod,After the {subj} {verb} the {obj} who {rel}
As the lawyer chased the doctor who called the office,As the lawyer vanished the doctor who called the office,for,was,chased,vanished,garden_npz_v-trans_mod,As the {subj} {verb} the {obj} who {rel}
As the lawyer vanished the doctor who called the office,As the lawyer chased the doctor who called the office,was,for,chased,vanished,garden_npz_v-trans_mod,As the {subj} {verb} the {obj} who {rel}
While the doctor ignored the chef who shouted too loud,While the doctor relaxed the chef who shouted too loud,for,was,ignored,relaxed,garden_npz_v-trans_mod,While the {subj} {verb} the {obj} who {rel}
While the doctor relaxed the chef who shouted too loud,While the doctor ignored the chef who shouted too loud,was,for,ignored,relaxed,garden_npz_v-trans_mod,While the {subj} {verb} the {obj} who {rel}
While the scientist rescued the tourist who broke the rule,While the scientist collapsed the tourist who broke the rule,for,was,rescued,collapsed,garden_npz_v-trans_mod,While the {subj} {verb} the {obj} who {rel}
While the scientist collapsed the tourist who broke the rule,While the scientist rescued the tourist who broke the rule,was,for,rescued,collapsed,garden_npz_v-trans_mod,While the {subj} {verb} the {obj} who {rel}
After the sailor punished the gardener who spoke too softly,After the sailor stumbled the gardener who spoke too softly,for,was,punished,stumbled,garden_npz_v-trans_mod,After the {subj} {verb} the {obj} who {rel}
After the sailor stumbled the gardener who spoke too softly,After the sailor punished the gardener who spoke too softly,was,for,punished,stumbled,garden_npz_v-trans_mod,After the {subj} {verb} the {obj} who {rel}
After the farmer attacked the singer who lost the ticket,After the farmer relaxed the singer who lost the ticket,for,was,attacked,relaxed,garden_npz_v-trans_mod,After the {subj} {verb} the {obj} who {rel}
After the farmer relaxed the singer who lost the ticket,After the farmer attacked the singer who lost the ticket,was,for,attacked,relaxed,garden_npz_v-trans_mod,After the {subj} {verb} the {obj} who {rel}
After the artist attacked the teacher who called the office,After the artist slept the teacher who called the office,for,was,attacked,slept,garden_npz_v-trans_mod,After the {subj} {verb} the {obj} who {rel}
After the artist slept the teacher who called the office,After the artist attacked the teacher who called the office,was,for,attacked,slept,garden_npz_v-trans_mod,After the {subj} {verb} the {obj} who {rel}
After the tourist visited the child who spoke too softly,After the tourist smiled the child who spoke too softly,for,was,visited,smiled,garden_npz_v-trans_mod,After the {subj} {verb} the {obj} who {rel}
After the tourist smiled the child who spoke too softly,After the tourist visited the child who spoke too softly,was,for,visited,smiled,garden_npz_v-trans_mod,After the {subj} {verb} the {obj} who {rel}
When the tourist killed the man who left early,When the tourist hesitated the man who left early,for,was,killed,hesitated,garden_npz_v-trans_mod,When the {subj} {verb} the {obj} who {rel}
When the tourist hesitated the man who left early,When the tourist killed the man who left early,was,for,killed,hesitated,garden_npz_v-trans_mod,When the {subj} {verb} the {obj} who {rel}
After the criminal supported the man who left early,After the criminal sighed the man who left early,for,was,supported,sighed,garden_npz_v-trans_mod,After the {subj} {verb} the {obj} who {rel}
After the criminal sighed the man who left early,After the criminal supported the man who left early,was,for,supported,sighed,garden_npz_v-trans_mod,After the {subj} {verb} the {obj} who {rel}
As the farmer photographed the gardener who paid the bill,As the farmer relaxed the gardener who paid the bill,for,was,photographed,relaxed,garden_npz_v-trans_mod,As the {subj} {verb} the {obj} who {rel}
As the farmer relaxed the gardener who paid the bill,As the farmer photographed the gardener who paid the bill,was,for,photographed,relaxed,garden_npz_v-trans_mod,As the {subj} {verb} the {obj} who {rel}
When the doctor visited the tourist who shouted too loud,When the doctor vanished the tourist who shouted too loud,for,was,visited,vanished,garden_npz_v-trans_mod,When the {subj} {verb} the {obj} who {rel}
When the doctor vanished the tourist who shouted too loud,When the doctor visited the tourist who shouted too loud,was,for,visited,vanished,garden_npz_v-trans_mod,When the {subj} {verb} the {obj} who {rel}
As the tourist pulled the driver who answered late,As the tourist arrived the driver who answered late,for,was,pulled,arrived,garden_npz_v-trans_mod,As the {subj} {verb} the {obj} who {rel}
As the tourist arrived the driver who answered late,As the tourist pulled the driver who answered late,was,for,pulled,arrived,garden_npz_v-trans_mod,As the {subj} {verb} the {obj} who {rel}
When the detective greeted the neighbor who left early,When the detective stumbled the neighbor who left early,for,was,greeted,stumbled,garden_npz_v-trans_mod,When the {subj} {verb} the {obj} who {rel}
When the detective stumbled the neighbor who left early,When the detective greeted the neighbor who left early,was,for,greeted,stumbled,garden_npz_v-trans_mod,When the {subj} {verb} the {obj} who {rel}
After the farmer questioned the child who answered late,After the farmer paused the child who answered late,for,was,questioned,paused,garden_npz_v-trans_mod,After the {subj} {verb} the {obj} who {rel}
After the farmer paused the child who answered late,After the farmer questioned the child who answered late,was,for,questioned,paused,garden_npz_v-trans_mod,After the {subj} {verb} the {obj} who {rel}
As the farmer attacked the child who wrote a letter,As the farmer paused the child who wrote a letter,for,was,attacked,paused,garden_npz_v-trans_mod,As the {subj} {verb} the {obj} who {rel}
As the farmer paused the child who wrote a letter,As the farmer attacked the child who wrote a letter,was,for,attacked,paused,garden_npz_v-trans_mod,As the {subj} {verb} the {obj} who {rel}
After the detective called the man who answered late,After the detective danced the man who answered late,for,was,called,danced,garden_npz_v-trans_mod,After the {subj} {verb} the {obj} who {rel}
After the detective danced the man who answered late,After the detective called the man who answered late,was,for,called,danced,garden_npz_v-trans_mod,After the {subj} {verb} the {obj} who {rel}
As the pilot followed the clerk who called the office,As the pilot slept the clerk who called the office,for,was,followed,slept,garden_npz_v-trans_mod,As the {subj} {verb} the {obj} who {rel}
As the pilot slept the clerk who called the office,As the pilot followed the clerk who called the office,was,for,followed,slept,garden_npz_v-trans_mod,As the {subj} {verb} the {obj} who {rel}
As the pilot followed the writer who answered late,As the pilot waited the writer who answered late,for,was,followed,waited,garden_npz_v-trans_mod,As the {subj} {verb} the {obj} who {rel}
As the pilot waited the writer who answered late,As the pilot followed the writer who answered late,was,for,followed,waited,garden_npz_v-trans_mod,As the {subj} {verb} the {obj} who {rel}
After the detective visited the tourist who waited outside,After the detective waited the tourist who waited outside,for,was,visited,waited,garden_npz_v-trans_mod,After the {subj} {verb} the {obj} who {rel}
After the detective waited the tourist who waited outside,After the detective visited the tourist who waited outside,was,for,visited,waited,garden_npz_v-trans_mod,After the {subj} {verb} the {obj} who {rel}
As the doctor frightened the gardener who left early,As the doctor laughed the gardener who left early,for,was,frightened,laughed,garden_npz_v-trans_mod,As the {subj} {verb} the {obj} who {rel}
As the doctor laughed the gardener who left early,As the doctor frightened the gardener who left early,was,for,frightened,laughed,garden_npz_v-trans_mod,As the {subj} {verb} the {obj} who {rel}
While the soldier grabbed the neighbor who made a mistake,While the soldier waited the neighbor who made a mistake,for,was,grabbed,waited,garden_npz_v-trans_mod,While the {subj} {verb} the {obj} who {rel}
While the soldier waited the neighbor who made a mistake,While the soldier grabbed the neighbor who made a mistake,was,for,grabbed,waited,garden_npz_v-trans_mod,While the {subj} {verb} the {obj} who {rel}
After the farmer followed the man who wrote a letter,After the farmer relaxed the man who wrote a letter,for,was,followed,relaxed,garden_npz_v-trans_mod,After the {subj} {verb} the {obj} who {rel}
After the farmer relaxed the man who wrote a letter,After the farmer followed the man who wrote a letter,was,for,followed,relaxed,garden_npz_v-trans_mod,After the {subj} {verb} the {obj} who {rel}
As the soldier blamed the clerk who broke the rule,As the soldier paused the clerk who broke the rule,for,was,blamed,paused,garden_npz_v-trans_mod,As the {subj} {verb} the {obj} who {rel}
As the soldier paused the clerk who broke the rule,As the soldier blamed the clerk who broke the rule,was,for,blamed,paused,garden_npz_v-trans_mod,As the {subj} {verb} the {obj} who {rel}
While the detective mocked the teacher who left early,While the detective danced the teacher who left early,for,was,mocked,danced,garden_npz_v-trans_mod,While the {subj} {verb} the {obj} who {rel}
While the detective danced the teacher who left early,While the detective mocked the teacher who left early,was,for,mocked,danced,garden_npz_v-trans_mod,While the {subj} {verb} the {obj} who {rel}
As the tourist blamed the teacher who lost the ticket,As the tourist wandered the teacher who lost the ticket,for,was,blamed,wandered,garden_npz_v-trans_mod,As the {subj} {verb} the {obj} who {rel}
As the tourist wandered the teacher who lost the ticket,As the tourist blamed the teacher who lost the ticket,was,for,blamed,wandered,garden_npz_v-trans_mod,As the {subj} {verb} the {obj} who {rel}
As the tourist photographed the child who won the prize,As the tourist departed the child who won the prize,for,was,photographed,departed,garden_npz_v-trans_mod,As the {subj} {verb} the {obj} who {rel}
As the tourist departed the child who won the prize,As the tourist photographed the child who won the prize,was,for,photographed,departed,garden_npz_v-trans_mod,As the {subj} {verb} the {obj} who {rel}
After the teacher punished the man who shouted too loud,After the teacher relaxed the man who shouted too loud,for,was,punished,relaxed,garden_npz_v-trans_mod,After the {subj} {verb} the {obj} who {rel}
After the teacher relaxed the man who shouted too loud,After the teacher punished the man who shouted too loud,was,for,punished,relaxed,garden_npz_v-trans_mod,After the {subj} {verb} the {obj} who {rel}
As the student fired the neighbor who called the office,As the student nodded the neighbor who called the office,for,was,fired,nodded,garden_npz_v-trans_mod,As the {subj} {verb} the {obj} who {rel}
As the student nodded the neighbor who called the office,As the student fired the neighbor who called the office,was,for,fired,nodded,garden_npz_v-trans_mod,As the {subj} {verb} the {obj} who {rel}
As the lawyer betrayed the driver who waited outside,As the lawyer arrived the driver who waited outside,for,was,betrayed,arrived,garden_npz_v-trans_mod,As the {subj} {verb} the {obj} who {rel}
As the lawyer arrived the driver who waited outside,As the lawyer betrayed the driver who waited outside,was,for,betrayed,arrived,garden_npz_v-trans_mod,As the {subj} {verb} the {obj} who {rel}
As the criminal betrayed the doctor who left early,As the criminal collapsed the doctor who left early,for,was,betrayed,collapsed,garden_npz_v-trans_mod,As the {subj} {verb} the {obj} who {rel}
As the criminal collapsed the doctor who left early,As the criminal betrayed the doctor who left early,was,for,betrayed,collapsed,garden_npz_v-trans_mod,As the {subj} {verb} the {obj} who {rel}
As the doctor greeted the clerk who paid the bill,As the doctor blinked the clerk who paid the bill,for,was,greeted,blinked,garden_npz_v-trans_mod,As the {subj} {verb} the {obj} who {rel}
As the doctor blinked the clerk who paid the bill,As the doctor greeted the clerk who paid the bill,was,for,greeted,blinked,garden_npz_v-trans_mod,As the {subj} {verb} the {obj} who {rel}
When the detective grabbed the child who left early,When the detective hesitated the child who left early,for,was,grabbed,hesitated,garden_npz_v-trans_mod,When the {subj} {verb} the {obj} who {rel}
When the detective hesitated the child who left early,When the detective grabbed the child who left early,was,for,grabbed,hesitated,garden_npz_v-trans_mod,When the {subj} {verb} the {obj} who {rel}
As the tourist frightened the neighbor who wrote a letter,As the tourist panicked the neighbor who wrote a letter,for,was,frightened,panicked,garden_npz_v-trans_mod,As the {subj} {verb} the {obj} who {rel}
As the tourist panicked the neighbor who wrote a letter,As the tourist frightened the neighbor who wrote a letter,was,for,frightened,panicked,garden_npz_v-trans_mod,As the {subj} {verb} the {obj} who {rel}
After the chef pushed the clerk who answered late,After the chef collapsed the clerk who answered late,for,was,pushed,collapsed,garden_npz_v-trans_mod,After the {subj} {verb} the {obj} who {rel}
After the chef collapsed the clerk who answered late,After the chef pushed the clerk who answered late,was,for,pushed,collapsed,garden_npz_v-trans_mod,After the {subj} {verb} the {obj} who {rel}
After the scientist frightened the student who left early,After the scientist laughed the student who left early,for,was,frightened,laughed,garden_npz_v-trans_mod,After the {subj} {verb} the {obj} who {rel}
After the scientist laughed the student who left early,After the scientist frightened the student who left early,was,for,frightened,laughed,garden_npz_v-trans_mod,After the {subj} {verb} the {obj} who {rel}
When the scientist insulted the driver who answered late,When the scientist panicked the driver who answered late,for,was,insulted,panicked,garden_npz_v-trans_mod,When the {subj} {verb} the {obj} who {rel}
When the scientist panicked the driver who answered late,When the scientist insulted the driver who answered late,was,for,insulted,panicked,garden_npz_v-trans_mod,When the {subj} {verb} the {obj} who {rel}
When the student supported the woman who paid the bill,When the student stumbled the woman who paid the bill,for,was,supported,stumbled,garden_npz_v-trans_mod,When the {subj} {verb} the {obj} who {rel}
When the student stumbled the woman who paid the bill,When the student supported the woman who paid the bill,was,for,supported,stumbled,garden_npz_v-trans_mod,When the {subj} {verb} the {obj} who {rel}
As the soldier chased the singer who called the office,As the soldier blinked the singer who called the office,for,was,chased,blinked,garden_npz_v-trans_mod,As the {subj} {verb} the {obj} who {rel}
As the soldier blinked the singer who called the office,As the soldier chased the singer who called the office,was,for,chased,blinked,garden_npz_v-trans_mod,As the {subj} {verb} the {obj} who {rel}
When the doctor called the doctor who broke the rule,When the doctor danced the doctor who broke the rule,for,was,called,danced,garden_npz_v-trans_mod,When the {subj} {verb} the {obj} who {rel}
When the doctor danced the doctor who broke the rule,When the doctor called the doctor who broke the rule,was,for,called,danced,garden_npz_v-trans_mod,When the {subj} {verb} the {obj} who {rel}
After the scientist pushed the neighbor who called the office,After the scientist wandered the neighbor who called the office,for,was,pushed,wandered,garden_npz_v-trans_mod,After the {subj} {verb} the {obj} who {rel}
After the scientist wandered the neighbor who called the office,After the scientist pushed the neighbor who called the office,was,for,pushed,wandered,garden_npz_v-trans_mod,After the {subj} {verb} the {obj} who {rel}
As the scientist mocked the teacher who answered late,As the scientist nodded the teacher who answered late,for,was,mocked,nodded,garden_npz_v-trans_mod,As the {subj} {verb} the {obj} who {rel}
As the scientist nodded the teacher who answered late,As the scientist mocked the teacher who answered late,was,for,mocked,nodded,garden_npz_v-trans_mod,As the {subj} {verb} the {obj} who {rel}
When the teacher helped the child who called the office,When the teacher slept the child who called the office,for,was,helped,slept,garden_npz_v-trans_mod,When the {subj} {verb} the {obj} who {rel}
When the teacher slept the child who called the office,When the teacher helped the child who called the office,was,for,helped,slept,garden_npz_v-trans_mod,When the {subj} {verb} the {obj} who {rel}
While the artist pushed the child who called the office,While the artist departed the child who called the office,for,was,pushed,departed,garden_npz_v-trans_mod,While the {subj} {verb} the {obj} who {rel}
While the artist departed the child who called the office,While the artist pushed the child who called the office,was,for,pushed,departed,garden_npz_v-trans_mod,While the {subj} {verb} the {obj} who {rel}
As the criminal escorted the singer who paid the bill,As the criminal vanished the singer who paid the bill,for,was,escorted,vanished,garden_npz_v-trans_mod,As the {subj} {verb} the {obj} who {rel}
As the criminal vanished the singer who paid the bill,As the criminal escorted the singer who paid the bill,was,for,escorted,vanished,garden_npz_v-trans_mod,As the {subj} {verb} the {obj} who {rel}
As the detective called the teacher who paid the bill,As the detective arrived the teacher who paid the bill,for,was,called,arrived,garden_npz_v-trans_mod,As the {subj} {verb} the {obj} who {rel}
As the detective arrived the teacher who paid the bill,As the detective called the teacher who paid the bill,was,for,called,arrived,garden_npz_v-trans_mod,As the {subj} {verb} the {obj} who {rel}
