clean,corrupted,correct_token,incorrect_token,transitive_verb,intransitive_verb,template,template_text
While the artist ignored the man who called the office,While the artist hesitated the man who called the office,for,was,ignored,hesitated,garden_npz_v-trans_mod,While the {subj} {verb} the {obj} who {rel}
While the artist hesitated the man who called the office,While the artist ignored the man who called the office,was,for,ignored,hesitated,garden_npz_v-trans_mod,While the {subj} {verb} the {obj} who {rel}
When the driver visited the student who told bad jokes,When the driver nodded the student who told bad jokes,for,was,visited,nodded,garden_npz_v-trans_mod,When the {subj} {verb} the {obj} who {rel}
When the driver nodded the student who told bad jokes,When the driver visited the student who told bad jokes,was,for,visited,nodded,garden_npz_v-trans_mod,When the {subj} {verb} the {obj} who {rel}
As the scientist called the woman who wrote a letter,As the scientist collapsed the woman who wrote a letter,for,was,called,collapsed,garden_npz_v-trans_mod,As the {subj} {verb} the {obj} who {rel}
As the scientist collapsed the woman who wrote a letter,As the scientist called the woman who wrote a letter,was,for,called,collapsed,garden_npz_v-trans_mod,As the {subj} {verb} the {obj} who {rel}
As the lawyer questioned the writer who shouted too loud,As the lawyer departed the writer who shouted too loud,for,was,questioned,departed,garden_npz_v-trans_mod,As the {subj} {verb} the {obj} who {rel}
As the lawyer departed the writer who shouted too loud,As the lawyer questioned the writer who shouted too loud,was,for,questioned,departed,garden_npz_v-trans_mod,As the {subj} {verb} the {obj} who {rel}
As the scientist blamed the doctor who paid the bill,As the scientist wandered the doctor who paid the bill,for,was,blamed,wandered,garden_npz_v-trans_mod,As the {subj} {verb} the {obj} who {rel}
As the scientist wandered the doctor who paid the bill,As the scientist blamed the doctor who paid the bill,was,for,blamed,wandered,garden_npz_v-trans_mod,As the {subj} {verb} the {obj} who {rel}
After the doctor shot the gardener who wrote a letter,After the doctor shouted the gardener who wrote a letter,for,was,shot,shouted,garden_npz_v-trans_mod,After the {subj} {verb} the {obj} who {rel}
After the doctor shouted the gardener who wrote a letter,After the doctor shot the gardener who wrote a letter,was,for,shot,shouted,garden_npz_v-trans_mod,After the {subj} {verb} the {obj} who {rel}
While the detective surprised the chef who paid the bill,While the detective stumbled the chef who paid the bill,for,was,surprised,stumbled,garden_npz_v-trans_mod,While the {subj} {verb} the {obj} who {rel}
While the detective stumbled the chef who paid the bill,While the detective surprised the chef who paid the bill,was,for,surprised,stumbled,garden_npz_v-trans_mod,While the {subj} {verb} the {obj} who {rel}
As the soldier shot the doctor who spoke too softly,As the soldier nodded the doctor who spoke too softly,for,was,shot,nodded,garden_npz_v-trans_mod,As the {subj} {verb} the {obj} who {rel}
As the soldier nodded the doctor who spoke too softly,As the soldier shot the doctor who spoke too softly,was,for,shot,nodded,garden_npz_v-trans_mod,As the {subj} {verb} the {obj} who {rel}
While the scientist insulted the student who paid the bill,While the scientist collapsed the student who paid the bill,for,was,insulted,collapsed,garden_npz_v-trans_mod,While the {subj} {verb} the {obj} who {rel}
While the scientist collapsed the student who paid the bill,While the scientist insulted the student who paid the bill,was,for,insulted,collapsed,garden_npz_v-trans_mod,While the {subj} {verb} the {obj} who {rel}
After the student surprised the student who lost the ticket,After the student laughed the student who lost the ticket,for,was,surprised,laughed,garden_npz_v-trans_mod,After the {subj} {verb} the {obj} who {rel}
After the student laughed the student who lost the ticket,After the student surprised the student who lost the ticket,was,for,surprised,laughed,garden_npz_v-trans_mod,After the {subj} {verb} the {obj} who {rel}
As the scientist pushed the driver who paid the bill,As the scientist nodded the driver who paid the bill,for,was,pushed,nodded,garden_npz_v-trans_mod,As the {subj} {verb} the {obj} who {rel}
As the scientist nodded the driver who paid the bill,As the scientist pushed the driver who paid the bill,was,for,pushed,nodded,garden_npz_v-trans_mod,As the {subj} {verb} the {obj} who {rel}
After the scientist escorted the tourist who shouted too loud,After the scientist stumbled the tourist who shouted too loud,for,was,escorted,stumbled,garden_npz_v-trans_mod,After the {subj} {verb} the {obj} who {rel}
After the scientist stumbled the tourist who shouted too loud,After the scientist escorted the tourist who shouted too loud,was,for,escorted,stumbled,garden_npz_v-trans_mod,After the {subj} {verb} the {obj} who {rel}
While the tourist mocked the chef who called the office,While the tourist blinked the chef who called the office,for,was,mocked,blinked,garden_npz_v-trans_mod,While the {subj} {verb} the {obj} who {rel}
While the tourist blinked the chef who called the office,While the tourist mocked the chef who called the office,was,for,mocked,blinked,garden_npz_v-trans_mod,While the {subj} {verb} the {obj} who {rel}
After the artist betrayed the chef who missed the train,After the artist sighed the chef who missed the train,for,was,betrayed,sighed,garden_npz_v-trans_mod,After the {subj} {verb} the {obj} who {rel}
After the artist sighed the chef who missed the train,After the artist betrayed the chef who missed the train,was,for,betrayed,sighed,garden_npz_v-trans_mod,After the {subj} {verb} the {obj} who {rel}
As the farmer greeted the neighbor who missed the train,As the farmer shouted the neighbor who missed the train,for,was,greeted,shouted,garden_npz_v-trans_mod,As the {subj} {verb} the {obj} who {rel}
As the farmer shouted the neighbor who missed the train,As the farmer greeted the neighbor who missed the train,was,for,greeted,shouted,garden_npz_v-trans_mod,As the {subj} {verb} the {obj} who {rel}
When the criminal insulted the clerk who told bad jokes,When the criminal paused the clerk who told bad jokes,for,was,insulted,paused,garden_npz_v-trans_mod,When the {subj} {verb} the {obj} who {rel}
When the criminal paused the clerk who told bad jokes,When the criminal insulted the clerk who told bad jokes,was,for,insulted,paused,garden_npz_v-trans_mod,When the {subj} {verb} the {obj} who {rel}
While the farmer supported the singer who spoke too softly,While the farmer vanished the singer who spoke too softly,for,was,supported,vanished,garden_npz_v-trans_mod,While the {subj} {verb} the {obj} who {rel}
While the farmer vanished the singer who spoke too softly,While the farmer supported the singer who spoke too softly,was,for,supported,vanished,garden_npz_v-trans_mod,While the {subj} {verb} the {obj} who {rel}
While the detective visited the gardener who waited outside,While the detective laughed the gardener who waited outside,for,was,visited,laughed,garden_npz_v-trans_mod,While the {subj} {verb} the {obj} who {rel}
While the detective laughed the gardener who waited outside,While the detective visited the gardener who waited outside,was,for,visited,laughed,garden_npz_v-trans_mod,While the {subj} {verb} the {obj} who {rel}
As the student watched the man who broke the rule,As the student shouted the man who broke the rule,for,was,watched,shouted,garden_npz_v-trans_mod,As the {subj} {verb} the {obj} who {rel}
As the student shouted the man who broke the rule,As the student watched the man who broke the rule,was,for,watched,shouted,garden_npz_v-trans_mod,As the {subj} {verb} the {obj} who {rel}
While the tourist surprised the singer who missed the train,While the tourist arrived the singer who missed the train,for,was,surprised,arrived,garden_npz_v-trans_mod,While the {subj} {verb} the {obj} who {rel}
While the tourist arrived the singer who missed the train,While the tourist surprised the singer who missed the train,was,for,surprised,arrived,garden_npz_v-trans_mod,While the {subj} {verb} the {obj} who {rel}
After the teacher frightened the doctor who called the office,After the teacher vanished the doctor who called the office,for,was,frightened,vanished,garden_npz_v-trans_mod,After the {subj} {verb} the {obj} who {rel}
After the teacher vanished the doctor who called the office,After the teacher frightened the doctor who called the office,was,for,frightened,vanished,garden_npz_v-trans_mod,After the {subj} {verb} the {obj} who {rel}
As the lawyer attacked the singer who forgot the keys,As the lawyer laughed the singer who forgot the keys,for,was,attacked,laughed,garden_npz_v-trans_mod,As the {subj} {verb} the {obj} who {rel}
As the lawyer laughed the singer who forgot the keys,As the lawyer attacked the singer who forgot the keys,was,for,attacked,laughed,garden_npz_v-trans_mod,As the {subj} {verb} the {obj} who {rel}
After the scientist visited the neighbor who won the prize,After the scientist laughed the neighbor who won the prize,for,was,visited,laughed,garden_npz_v-trans_mod,After the {subj} {verb} the {obj} who {rel}
After the scientist laughed the neighbor who won the prize,After the scientist visited the neighbor who won the prize,was,for,visited,laughed,garden_npz_v-trans_mod,After the {subj} {verb} the {obj} who {rel}
While the student chased the tourist who missed the train,While the student vanished the tourist who missed the train,for,was,chased,vanished,garden_npz_v-trans_mod,While the {subj} {verb} the {obj} who {rel}
While the student vanished the tourist who missed the train,While the student chased the tourist who missed the train,was,for,chased,vanished,garden_npz_v-trans_mod,While the {subj} {verb} the {obj} who {rel}
When the sailor visited the neighbor who called the office,When the sailor paused the neighbor who called the office,for,was,visited,paused,garden_npz_v-trans_mod,When the {subj} {verb} the {obj} who {rel}
When the sailor paused the neighbor who called the office,When the sailor visited the neighbor who called the office,was,for,visited,paused,garden_npz_v-trans_mod,When the {subj} {verb} the {obj} who {rel}
When the driver pulled the man who paid the bill,When the driver panicked the man who paid the bill,for,was,pulled,panicked,garden_npz_v-trans_mod,When the {subj} {verb} the {obj} who {rel}
When the driver panicked the man who paid the bill,When the driver pulled the man who paid the bill,was,for,pulled,panicked,garden_npz_v-trans_mod,When the {subj} {verb} the {obj} who {rel}
While the tourist mocked the chef who spoke too softly,While the tourist departed the chef who spoke too softly,for,was,mocked,departed,garden_npz_v-trans_mod,While the {subj} {verb} the {obj} who {rel}
While the tourist departed the chef who spoke too softly,While the tourist mocked the chef who spoke too softly,was,for,mocked,departed,garden_npz_v-trans_mod,While the {subj} {verb} the {obj} who {rel}
After the doctor questioned the chef who told bad jokes,After the doctor sighed the chef who told bad jokes,for,was,questioned,sighed,garden_npz_v-trans_mod,After the {subj} {verb} the {obj} who {rel}
After the doctor sighed the chef who told bad jokes,After the doctor questioned the chef who told bad jokes,was,for,questioned,sighed,garden_npz_v-trans_mod,After the {subj} {verb} the {obj} who {rel}
While the criminal grabbed the teacher who lost the ticket,While the criminal nodded the teacher who lost the ticket,for,was,grabbed,nodded,garden_npz_v-trans_mod,While the {subj} {verb} the {obj} who {rel}
While the criminal nodded the teacher who lost the ticket,While the criminal grabbed the teacher who lost the ticket,was,for,grabbed,nodded,garden_npz_v-trans_mod,While the {subj} {verb} the {obj} who {rel}
As the scientist watched the doctor who won the prize,As the scientist departed the doctor who won the prize,for,was,watched,departed,garden_npz_v-trans_mod,As the {subj} {verb} the {obj} who {rel}
As the scientist departed the doctor who won the prize,As the scientist watched the doctor who won the prize,was,for,watched,departed,garden_npz_v-trans_mod,As the {subj} {verb} the {obj} who {rel}
When the lawyer greeted the student who won the prize,When the lawyer slept the student who won the prize,for,was,greeted,slept,garden_npz_v-trans_mod,When the {subj} {verb} the {obj} who {rel}
When the lawyer slept the student who won the prize,When the lawyer greeted the student who won the prize,was,for,greeted,slept,garden_npz_v-trans_mod,When the {subj} {verb} the {obj} who {rel}
While the tourist supported the teacher who left early,While the tourist collapsed the teacher who left early,for,was,supported,collapsed,garden_npz_v-trans_mod,While the {subj} {verb} the {obj} who {rel}
While the tourist collapsed the teacher who left early,While the tourist supported the teacher who left early,was,for,supported,collapsed,garden_npz_v-trans_mod,While the {subj} {verb} the {obj} who {rel}
As the pilot ignored the clerk who won the prize,As the pilot sighed the clerk who won the prize,for,was,ignored,sighed,garden_npz_v-trans_mod,As the {subj} {verb} the {obj} who {rel}
As the pilot sighed the clerk who won the prize,As the pilot ignored the clerk who won the prize,was,for,ignored,sighed,garden_npz_v-trans_mod,As the {subj} {verb} the {obj} who {rel}
When the doctor called the doctor who made a mistake,When the doctor paused the doctor who made a mistake,for,was,called,paused,garden_npz_v-trans_mod,When the {subj} {verb} the {obj} who {rel}
When the doctor paused the doctor who made a mistake,When the doctor called the doctor who made a mistake,was,for,called,paused,garden_npz_v-trans_mod,When the {subj} {verb} the {obj} who {rel}
While the pilot arrested the chef who told bad jokes,While the pilot danced the chef who told bad jokes,for,was,arrested,danced,garden_npz_v-trans_mod,While the {subj} {verb} the {obj} who {rel}
While the pilot danced the chef who told bad jokes,While the pilot arrested the chef who told bad jokes,was,for,arrested,danced,garden_npz_v-trans_mod,While the {subj} {verb} the {obj} who {rel}
When the sailor fired the singer who shouted too loud,When the sailor hesitated the singer who shouted too loud,for,was,fired,hesitated,garden_npz_v-trans_mod,When the {subj} {verb} the {obj} who {rel}
When the sailor hesitated the singer who shouted too loud,When the sailor fired the singer who shouted too loud,was,for,fired,hesitated,garden_npz_v-trans_mod,When the {subj} {verb} the {obj} who {rel}
As the chef mocked the tourist who missed the train,As the chef blinked the tourist who missed the train,for,was,mocked,blinked,garden_npz_v-trans_mod,As the {subj} {verb} the {obj} who {rel}
As the chef blinked the tourist who missed the train,As the chef mocked the tourist who missed the train,was,for,mocked,blinked,garden_npz_v-trans_mod,As the {subj} {verb} the {obj} who {rel}
After the driver frightened the doctor who lost the ticket,After the driver slept the doctor who lost the ticket,for,was,frightened,slept,garden_npz_v-trans_mod,After the {subj} {verb} the {obj} who {rel}
After the driver slept the doctor who lost the ticket,After the driver frightened the doctor who lost the ticket,was,for,frightened,slept,garden_npz_v-trans_mod,After the {subj} {verb} the {obj} who {rel}
As the chef rescued the clerk who told bad jokes,As the chef shouted the clerk who told bad jokes,for,was,rescued,shouted,garden_npz_v-trans_mod,As the {subj} {verb} the {obj} who {rel}
As the chef shouted the clerk who told bad jokes,As the chef rescued the clerk who told bad jokes,was,for,rescued,shouted,garden_npz_v-trans_mod,As the {subj} {verb} the {obj} who {rel}
As the doctor blamed the writer who broke the rule,As the doctor wandered the writer who broke the rule,for,was,blamed,wandered,garden_npz_v-trans_mod,As the {subj} {verb} the {obj} who {rel}
As the doctor wandered the writer who broke the rule,As the doctor blamed the writer who broke the rule,was,for,blamed,wandered,garden_npz_v-trans_mod,As the {subj} {verb} the {obj} who {rel}
While the farmer frightened the doctor who missed the train,While the farmer relaxed the doctor who missed the train,for,was,frightened,relaxed,garden_npz_v-trans_mod,While the {subj} {verb} the {obj} who {rel}
While the farmer relaxed the doctor who missed the train,While the farmer frightened the doctor who missed the train,was,for,frightened,relaxed,garden_npz_v-trans_mod,While the {subj} {verb} the {obj} who {rel}
When the scientist supported the singer who missed the train,When the scientist collapsed the singer who missed the train,for,was,supported,collapsed,garden_npz_v-trans_mod,When the {subj} {verb} the {obj} who {rel}
When the scientist collapsed the singer who missed the train,When the scientist supported the singer who missed the train,was,for,supported,collapsed,garden_npz_v-trans_mod,When the {subj} {verb} the {obj} who {rel}
When the student visited the tourist who broke the rule,When the student sighed the tourist who broke the rule,for,was,visited,sighed,garden_npz_v-trans_mod,When the {subj} {verb} the {obj} who {rel}
When the student sighed the tourist who broke the rule,When the student visited the tourist who broke the rule,was,for,visited,sighed,garden_npz_v-trans_mod,When the {subj} {verb} the {obj} who {rel}
After the soldier chased the student who made a mistake,After the soldier sighed the student who made a mistake,for,was,chased,sighed,garden_npz_v-trans_mod,After the {subj} {verb} the {obj} who {rel}
After the soldier sighed the student who made a mistake,After the soldier chased the student who made a mistake,was,for,chased,sighed,garden_npz_v-trans_mod,After the {subj} {verb} the {obj} who {rel}
When the teacher pulled the teacher who told bad jokes,When the teacher panicked the teacher who told bad jokes,for,was,pulled,panicked,garden_npz_v-trans_mod,When the {subj} {verb} the {obj} who {rel}
When the teacher panicked the teacher who told bad jokes,When the teacher pulled the teacher who told bad jokes,was,for,pulled,panicked,garden_npz_v-trans_mod,When the {subj} {verb} the {obj} who {rel}
As the farmer followed the student who paid the bill,As the farmer vanished the student who paid the bill,for,was,followed,vanished,garden_npz_v-trans_mod,As the {subj} {verb} the {obj} who {rel}
As the farmer vanished the student who paid the bill,As the farmer followed the student who paid the bill,was,for,followed,vanished,garden_npz_v-trans_mod,As the {subj} {verb} the {obj} who {rel}
While the scientist pulled the gardener who lost the ticket,While the scientist panicked the gardener who lost the ticket,for,was,pulled,panicked,garden_npz_v-trans_mod,While the {subj} {verb} the {obj} who {rel}
While the scientist panicked the gardener who lost the ticket,While the scientist pulled the gardener who lost the ticket,was,for,pulled,panicked,garden_npz_v-trans_mod,While the {subj} {verb} the {obj} who {rel}
When the pilot helped the clerk who waited outside,When the pilot laughed the clerk who waited outside,for,was,helped,laughed,garden_npz_v-trans_mod,When the {subj} {verb} the {obj} who {rel}
When the pilot laughed the clerk who waited outside,When the pilot helped the clerk who waited outside,was,for,helped,laughed,garden_npz_v-trans_mod,When the {subj} {verb} the {obj} who {rel}
As the lawyer grabbed the man who broke the rule,As the lawyer relaxed the man who broke the rule,for,was,grabbed,relaxed,garden_npz_v-trans_mod,As the {subj} {verb} the {obj} who {rel}
As the lawyer relaxed the man who broke the rule,As the lawyer grabbed the man who broke the rule,was,for,grabbed,relaxed,garden_npz_v-trans_mod,As the {subj} {verb} the {obj} who {rel}
As the driver followed the neighbor who won the prize,As the driver shouted the neighbor who won the prize,for,was,followed,shouted,garden_npz_v-trans_mod,As the {subj} {verb} the {obj} who {rel}
As the driver shouted the neighbor who won the prize,As the driver followed the neighbor who won the prize,was,for,followed,shouted,garden_npz_v-trans_mod,As the {subj} {verb} the {obj} who {rel}
While the artist grabbed the child who called the office,While the artist collapsed the child who called the office,for,was,grabbed,collapsed,garden_npz_v-trans_mod,While the {subj} {verb} the {obj} who {rel}
While the artist collapsed the child who called the office,While the artist grabbed the child who called the office,was,for,grabbed,collapsed,garden_npz_v-trans_mod,While the {subj} {verb} the {obj} who {rel}
While the teacher supported the tourist who called the office,While the teacher departed the tourist who called the office,for,was,supported,departed,garden_npz_v-trans_mod,While the {subj} {verb} the {obj} who {rel}
While the teacher departed the tourist who called the office,While the teacher supported the tourist who called the office,was,for,supported,departed,garden_npz_v-trans_mod,While the {subj} {verb} the {obj} who {rel}
While the detective pulled the neighbor who waited outside,While the detective danced the neighbor who waited outside,for,was,pulled,danced,garden_npz_v-trans_mod,While the {subj} {verb} the {obj} who {rel}
While the detective danced the neighbor who waited outside,While the detective pulled the neighbor who waited outside,was,for,pulled,danced,garden_npz_v-trans_mod,While the {subj} {verb} the {obj} who {rel}
As the farmer grabbed the student who answered late,As the farmer vanished the student who answered late,for,was,grabbed,vanished,garden_npz_v-trans_mod,As the {subj} {verb} the {obj} who {rel}
As the farmer vanished the student who answered late,As the farmer grabbed the student who answered late,was,for,grabbed,vanished,garden_npz_v-trans_mod,As the {subj} {verb} the {obj} who {rel}
As the detective ignored the neighbor who broke the rule,As the detective smiled the neighbor who broke the rule,for,was,ignored,smiled,garden_npz_v-trans_mod,As the {subj} {verb} the {obj} who {rel}
As the detective smiled the neighbor who broke the rule,As the detective ignored the neighbor who broke the rule,was,for,ignored,smiled,garden_npz_v-trans_mod,As the {subj} {verb} the {obj} who {rel}
When the pilot pushed the neighbor who paid the bill,When the pilot vanished the neighbor who paid the bill,for,was,pushed,vanished,garden_npz_v-trans_mod,When the {subj} {verb} the {obj} who {rel}
When the pilot vanished the neighbor who paid the bill,When the pilot pushed the neighbor who paid the bill,was,for,pushed,vanished,garden_npz_v-trans_mod,When the {subj} {verb} the {obj} who {rel}
As the farmer fired the gardener who made a mistake,As the farmer wandered the gardener who made a mistake,for,was,fired,wandered,garden_npz_v-trans_mod,As the {subj} {verb} the {obj} who {rel}
As the farmer wandered the gardener who made a mistake,As the farmer fired the gardener who made a mistake,was,for,fired,wandered,garden_npz_v-trans_mod,As the {subj} {verb} the {obj} who {rel}
After the criminal pushed the man who made a mistake,After the criminal arrived the man who made a mistake,for,was,pushed,arrived,garden_npz_v-trans_mod,After the {subj} {verb} the {obj} who {rel}
After the criminal arrived the man who made a mistake,After the criminal pushed the man who made a mistake,was,for,pushed,arrived,garden_npz_v-trans_mod,After the {subj} {verb} the {obj} who {rel}
As the soldier insulted the doctor who forgot the keys,As the soldier stumbled the doctor who forgot the keys,for,was,insulted,stumbled,garden_npz_v-trans_mod,As the {subj} {verb} the {obj} who {rel}
As the soldier stumbled the doctor who forgot the keys,As the soldier insulted the doctor who forgot the keys,was,for,insulted,stumbled,garden_npz_v-trans_mod,As the {subj} {verb} the {obj} who {rel}
As the driver rescued the writer who shouted too loud,As the driver panicked the writer who shouted too loud,for,was,rescued,panicked,garden_npz_v-trans_mod,As the {subj} {verb} the {obj} who {rel}
As the driver panicked the writer who shouted too loud,As the driver rescued the writer who shouted too loud,was,for,rescued,panicked,garden_npz_v-trans_mod,As the {subj} {verb} the {obj} who {rel}
While the lawyer followed the driver who forgot the keys,While the lawyer danced the driver who forgot the keys,for,was,followed,danced,garden_npz_v-trans_mod,While the {subj} {verb} the {obj} who {rel}
While the lawyer danced the driver who forgot the keys,While the lawyer followed the driver who forgot the keys,was,for,followed,danced,garden_npz_v-trans_mod,While the {subj} {verb} the {obj} who {rel}
While the lawyer supported the student who broke the rule,While the lawyer collapsed the student who broke the rule,for,was,supported,collapsed,garden_npz_v-trans_mod,While the {subj} {verb} the {obj} who {rel}
While the lawyer collapsed the student who broke the rule,While the lawyer supported the student who broke the rule,was,for,supported,collapsed,garden_npz_v-trans_mod,While the {subj} {verb} the {obj} who {rel}
When the artist frightened the writer who paid the bill,When the artist blinked the writer who paid the bill,for,was,frightened,blinked,garden_npz_v-trans_mod,When the {subj} {verb} the {obj} who {rel}
When the artist blinked the writer who paid the bill,When the artist frightened the writer who paid the bill,was,for,frightened,blinked,garden_npz_v-trans_mod,When the {subj} {verb} the {obj} who {rel}
As the doctor hired the gardener who wrote a letter,As the doctor departed the gardener who wrote a letter,for,was,hired,departed,garden_npz_v-trans_mod,As the {subj} {verb} the {obj} who {rel}
As the doctor departed the gardener who wrote a letter,As the doctor hired the gardener who wrote a letter,was,for,hired,departed,garden_npz_v-trans_mod,As the {subj} {verb} the {obj} who {rel}
